{
  "$schema": "../../../docs/assistant/esquemas/assistant.schema.json",
  "id": "dot",
  "name": "Dot",
  "version": "1.2.0",
  "author": "Kobayashi82",
  "description": {
    "es": "El asistente mínimo de ejemplo: un punto que se teletransporta.",
    "en": "The minimal example assistant: a dot that teleports.",
    "fr": "L’assistant minimal d’exemple : un point qui se téléporte.",
    "de": "Der minimale Beispielassistent: ein Punkt, der sich teleportiert.",
    "it": "L’assistente minimo di esempio: un punto che si teletrasporta.",
    "pt": "O assistente mínimo de exemplo: um ponto que se teletransporta."
  },
  "homepage": "https://github.com/Kobayashi82/K-Desktop",
  "license": "MIT",
  "sdk": "1.0",
  "entry": "lib/DotAssistant.dll!DotAssistant.Dot",
  "icon": "icon.png",
  "wakeWord": "Dot",
  "traits": {
    "travel": "teleport",
    "travelSpeed": 5000,
    "canMoveWindows": false,
    "canReachMaximized": true,
    "gestures": ["communicate", "react"]
  },
  "extras": [
    { "id": "dot.jump", "name": { "es": "Saltar ahora", "en": "Jump now", "fr": "Sauter maintenant", "de": "Jetzt springen", "it": "Salta ora", "pt": "Saltar agora" }, "icon": "kd:ArrowBounce" }
  ]
}
